{
  "$schema": "https://json-schema.org/draft/2020-12/schema",
  "$id": "https://occicat.com/schemas/olomoc-catalog.schema.json",
  "title": "Olomòc — référentiel de cartes",
  "description": "Référentiel statique des cartes, neutre en langue : rouages, équipements/dons et ministères (ids, codes, caractéristiques, coûts, règles). Les textes (noms, titres, effets de jeu) vivent dans les paquets de langue (olomoc-texts.schema.json) ; les appartenances aux factions dans olomoc-factions.schema.json.",
  "type": "object",
  "additionalProperties": false,
  "required": [
    "version",
    "ministries",
    "cogs",
    "equipment"
  ],
  "properties": {
    "$schema": {
      "type": "string",
      "description": "Chemin vers ce schéma, pour l'autocomplétion dans l'éditeur."
    },
    "version": {
      "type": "string",
      "description": "Version du référentiel (semver ou date d'édition).",
      "examples": [
        "2026.1"
      ]
    },
    "ministries": {
      "type": "array",
      "items": {
        "$ref": "#/$defs/ministry"
      },
      "uniqueItems": true
    },
    "cogs": {
      "type": "array",
      "items": {
        "$ref": "#/$defs/cog"
      },
      "uniqueItems": true
    },
    "equipment": {
      "type": "array",
      "items": {
        "$ref": "#/$defs/equipment"
      },
      "uniqueItems": true
    },
    "cabals": {
      "type": "array",
      "items": {
        "$ref": "#/$defs/cabal"
      },
      "uniqueItems": true
    }
  },
  "$defs": {
    "id": {
      "type": "string",
      "description": "Identifiant stable, imprimé au dos de la carte.",
      "minLength": 1,
      "maxLength": 64,
      "$comment": "Format non arrêté : contrainte volontairement large. Resserrer avec un \"pattern\" une fois la convention d'Occicat connue."
    },
    "ministryCode": {
      "type": "string",
      "description": "Ministère d'affiliation. La Frange (FRINGE) et l'Axe (AXIS) sont les Ministères dévoyés (LDR p.25).",
      "enum": [
        "COORDINATION",
        "INTEGRITY",
        "EFFORT",
        "PROGRESS",
        "HARMONY",
        "EDIFICATION",
        "SECURITY",
        "FRINGE",
        "AXIS"
      ]
    },
    "factionCode": {
      "type": "string",
      "description": "Code de faction, défini par le référentiel de faction publié par Occicat (LDR p.32).",
      "pattern": "^[A-Z0-9_]{2,32}$"
    },
    "ministry": {
      "type": "object",
      "additionalProperties": false,
      "required": [
        "code"
      ],
      "properties": {
        "code": {
          "$ref": "#/$defs/ministryCode"
        },
        "emblem": {
          "type": "string"
        }
      }
    },
    "frequency": {
      "type": "object",
      "description": "Fréquence d'utilisation (LDR p.20) : N fois par phase de planification (couronne), par cycle (pentagone) ou par partie (cercle, cases d'usage imprimées sur la carte). Sans fréquence, pas de limite.",
      "additionalProperties": false,
      "required": [
        "count",
        "per"
      ],
      "properties": {
        "count": {
          "type": "integer",
          "minimum": 1
        },
        "per": {
          "type": "string",
          "enum": [
            "PLANNING_PHASE",
            "CYCLE",
            "GAME"
          ]
        }
      }
    },
    "ability": {
      "type": "object",
      "description": "Capacité spécifique (LDR p.20) : temporalité, coût et fréquence d'utilisation. Le nom et l'effet de jeu sont dans les paquets de langue, dans le même ordre. Pictogrammes (LDR p.20) : flèche = Active, flèche circulaire = Permanente ; cube blanc = 1 pion d'action, cube noir = 1 pion de Noirceur (autant que de symboles) ; couronne N = N fois par phase de planification, pentagone N = N fois par cycle, cercle N = N fois par partie.",
      "additionalProperties": false,
      "required": [
        "timing",
        "actionCost",
        "darknessCost"
      ],
      "properties": {
        "timing": {
          "type": "string",
          "enum": [
            "Active",
            "Permanent"
          ],
          "description": "Temporalité : Active (utilisable seulement lorsque le rouage est actif) ou Permanente (selon les conditions de l'effet de jeu, à tout moment)."
        },
        "actionCost": {
          "type": "integer",
          "minimum": 0,
          "maximum": 4,
          "description": "Coût en pions d'action (nombre de cubes blancs), pris dans la réserve d'action du rouage. 0 = aucun."
        },
        "darknessCost": {
          "type": "integer",
          "minimum": 0,
          "maximum": 3,
          "description": "Coût en pions de Noirceur (nombre de cubes noirs) : pions générés au rouage qui utilise la capacité."
        },
        "frequencies": {
          "type": "array",
          "description": "Limites d'utilisation cumulatives (ex. 1 par planification ET 3 par partie). Absente = illimitée.",
          "items": {
            "$ref": "#/$defs/frequency"
          },
          "minItems": 1
        }
      }
    },
    "stats": {
      "type": "object",
      "description": "Caractéristiques (LDR p.15) : Technique, Combat, Tir, Esquive. Une valeur de 0 interdit toute capacité impliquant un jet avec cette caractéristique.",
      "additionalProperties": false,
      "required": [
        "tech",
        "melee",
        "ranged",
        "dodge"
      ],
      "properties": {
        "tech": {
          "type": "integer",
          "minimum": 0,
          "maximum": 10
        },
        "melee": {
          "type": "integer",
          "minimum": 0,
          "maximum": 10
        },
        "ranged": {
          "type": "integer",
          "minimum": 0,
          "maximum": 10
        },
        "dodge": {
          "type": "integer",
          "minimum": 0,
          "maximum": 10
        }
      }
    },
    "art": {
      "type": "object",
      "additionalProperties": false,
      "required": [
        "front"
      ],
      "properties": {
        "front": {
          "type": "string",
          "minLength": 1
        },
        "back": {
          "type": "string",
          "minLength": 1
        }
      }
    },
    "cog": {
      "type": "object",
      "title": "Rouage",
      "description": "Carte profil d'un rouage (LDR p.15), partie neutre.",
      "additionalProperties": false,
      "required": [
        "id",
        "ministries",
        "rank",
        "stats",
        "lifeLine",
        "abilities"
      ],
      "properties": {
        "id": {
          "$ref": "#/$defs/id"
        },
        "ministries": {
          "type": "array",
          "description": "Le ou les ministères d'affiliation imprimés sur la carte.",
          "items": {
            "$ref": "#/$defs/ministryCode"
          },
          "minItems": 1,
          "uniqueItems": true
        },
        "rank": {
          "type": "integer",
          "minimum": 0,
          "maximum": 9
        },
        "baseSize": {
          "type": "integer",
          "enum": [
            30,
            40,
            50
          ],
          "description": "Taille de socle en mm, imprimée au verso de la carte. Optionnelle."
        },
        "stats": {
          "$ref": "#/$defs/stats"
        },
        "lifeLine": {
          "$ref": "#/$defs/lifeLine"
        },
        "abilities": {
          "type": "array",
          "items": {
            "$ref": "#/$defs/ability"
          }
        },
        "extraEquipment": {
          "type": "object",
          "description": "Le rouage peut être équipé d'une carte supplémentaire au début du premier cycle (ex. Medic Ruzicka : un équipement affilié au Ministère de l'Intégrité). Choisie en mode partie, hors constitution de la cabale ; pas de doublon avec les cartes de la cabale.",
          "additionalProperties": false,
          "required": [
            "ministry",
            "kind"
          ],
          "properties": {
            "ministry": {
              "$ref": "#/$defs/ministryCode"
            },
            "kind": {
              "type": "string",
              "enum": [
                "EQUIPMENT",
                "BOON"
              ]
            }
          }
        },
        "art": {
          "$ref": "#/$defs/art"
        },
        "set": {
          "type": "string",
          "description": "Boîte / extension d'origine."
        },
        "published": {
          "type": "boolean",
          "description": "true : publiée, visible de tous. Absent ou false : brouillon (éditeur des admins), invisible des visiteurs."
        }
      }
    },
    "buildRule": {
      "type": "object",
      "title": "Règle de composition",
      "description": "ALL_MINISTRIES : le porteur compte comme affilié à tous les ministères pendant la constitution (il ne peut pas débloquer la carte qui lui confère cet effet). RECRUIT_WEARER : le porteur, si son rang figure dans ranks, peut être recruté hors de la faction de la cabale. RECRUIT_MINISTRY : la cabale peut recruter un rouage hors faction affilié à ministry, si son rang figure dans ranks.",
      "additionalProperties": false,
      "required": [
        "type"
      ],
      "properties": {
        "type": {
          "type": "string",
          "enum": [
            "ALL_MINISTRIES",
            "RECRUIT_WEARER",
            "RECRUIT_MINISTRY"
          ]
        },
        "ranks": {
          "type": "array",
          "items": {
            "type": "integer",
            "minimum": 0,
            "maximum": 9
          },
          "minItems": 1,
          "uniqueItems": true
        },
        "ministry": {
          "$ref": "#/$defs/ministryCode"
        }
      },
      "allOf": [
        {
          "if": {
            "properties": {
              "type": {
                "const": "RECRUIT_WEARER"
              }
            }
          },
          "then": {
            "required": [
              "ranks"
            ]
          }
        },
        {
          "if": {
            "properties": {
              "type": {
                "const": "RECRUIT_MINISTRY"
              }
            }
          },
          "then": {
            "required": [
              "ranks",
              "ministry"
            ]
          }
        }
      ]
    },
    "cabal": {
      "type": "object",
      "title": "Cabale",
      "description": "Cabale : 3 rouages (un rang 1, un rang 2 et un rang 3) appartenant à la même faction, chacun équipé d'un équipement/don (LDR p.32).",
      "additionalProperties": false,
      "required": [
        "id",
        "name",
        "faction",
        "slots"
      ],
      "properties": {
        "id": {
          "$ref": "#/$defs/id"
        },
        "name": {
          "type": "string",
          "minLength": 1
        },
        "faction": {
          "$ref": "#/$defs/factionCode"
        },
        "slots": {
          "type": "array",
          "minItems": 3,
          "maxItems": 3,
          "uniqueItems": true,
          "items": {
            "type": "object",
            "additionalProperties": false,
            "required": [
              "cogId",
              "equipmentId"
            ],
            "properties": {
              "cogId": {
                "$ref": "#/$defs/id"
              },
              "equipmentId": {
                "$ref": "#/$defs/id"
              }
            }
          }
        }
      }
    },
    "healthPointType": {
      "type": "string",
      "description": "Type de point de vie (LDR p.16). S (standard) : pas de règle particulière. R (renforcé, dit Protection) : lorsqu'un rouage subit des blessures suite à une attaque et qu'il reste au moins un PV renforcé à cocher, diminuez de 1 le nombre de blessures subies ; imprimé en gris (uni ou hachuré selon l'édition). T (teinté) : le rouage reçoit un pion de Noirceur et aucun PV au-delà ne peut être coché jusqu'à la fin de l'attaque.",
      "enum": [
        "S",
        "R",
        "T"
      ]
    },
    "lifeLine": {
      "type": "array",
      "description": "Ligne de vie : PV ordonnés, cochés de gauche à droite.",
      "items": {
        "$ref": "#/$defs/healthPointType"
      },
      "minItems": 1,
      "maxItems": 30
    },
    "equipment": {
      "type": "object",
      "title": "Équipement / Don",
      "description": "Carte équipement ou don (LDR p.32), partie neutre. Chaque rouage d'une cabale doit être équipé d'un équipement/don. Affiliation exclusive : un Ministère, ou une faction, ou le rouage équipé.",
      "additionalProperties": false,
      "required": [
        "id",
        "kind",
        "abilities"
      ],
      "properties": {
        "id": {
          "$ref": "#/$defs/id"
        },
        "kind": {
          "type": "string",
          "enum": [
            "EQUIPMENT",
            "BOON"
          ],
          "description": "EQUIPMENT = carte équipement, BOON = carte don."
        },
        "ministry": {
          "$ref": "#/$defs/ministryCode",
          "description": "Affilié à un Ministère : disponible si un rouage de la cabale est affilié à ce Ministère, qui ne rend disponible qu'un seul équipement/don. Exclusif."
        },
        "faction": {
          "$ref": "#/$defs/factionCode",
          "description": "Affilié à une faction : disponible si la cabale est de cette faction. Exclusif."
        },
        "cogId": {
          "$ref": "#/$defs/id",
          "description": "Affilié au rouage équipé : disponible seulement pour ce rouage. Exclusif."
        },
        "abilities": {
          "type": "array",
          "items": {
            "$ref": "#/$defs/ability"
          }
        },
        "lifeLinePrefix": {
          "type": "array",
          "description": "PV ajoutés au début de la ligne de vie du rouage équipé, dans l'ordre (ex. Carapace : deux PV renforcés). Appliqué par le mode partie. Absent = aucun.",
          "items": {
            "$ref": "#/$defs/healthPointType"
          },
          "minItems": 1
        },
        "art": {
          "$ref": "#/$defs/art"
        },
        "set": {
          "type": "string"
        },
        "published": {
          "type": "boolean",
          "description": "true : publiée, visible de tous. Absent ou false : brouillon (éditeur des admins), invisible des visiteurs."
        },
        "buildRules": {
          "type": "array",
          "description": "Effets de la carte sur la constitution de la cabale, appliqués par le constructeur. Absent = aucun.",
          "items": {
            "$ref": "#/$defs/buildRule"
          },
          "minItems": 1
        }
      },
      "oneOf": [
        {
          "required": [
            "ministry"
          ]
        },
        {
          "required": [
            "faction"
          ]
        },
        {
          "required": [
            "cogId"
          ]
        }
      ],
      "$comment": "Les trois cas de disponibilité du LDR p.32 sont mutuellement exclusifs : la carte porte une affiliation et une seule. La sémantique « exactement une branche » de oneOf suffit."
    }
  }
}
