{
  "$schema": "../../../../schemas/olomoc.schema.json",
  "version": "2026.10",
  "ministries": [
    {
      "code": "COORDINATION"
    },
    {
      "code": "INTEGRITY"
    },
    {
      "code": "EFFORT"
    },
    {
      "code": "PROGRESS"
    },
    {
      "code": "HARMONY"
    },
    {
      "code": "EDIFICATION"
    },
    {
      "code": "SECURITY"
    },
    {
      "code": "FRINGE"
    },
    {
      "code": "AXIS"
    }
  ],
  "cogs": [
    {
      "id": "1R01",
      "ministries": [
        "SECURITY"
      ],
      "rank": 3,
      "stats": {
        "tech": 2,
        "melee": 4,
        "ranged": 7,
        "dodge": 3
      },
      "lifeLine": [
        "R",
        "R",
        "R",
        "R",
        "S",
        "T",
        "S",
        "S",
        "S",
        "S",
        "S",
        "S"
      ],
      "abilities": [
        {
          "timing": "Active",
          "actionCost": 0,
          "darknessCost": 1,
          "frequencies": [
            {
              "count": 1,
              "per": "CYCLE"
            }
          ]
        }
      ],
      "art": {
        "front": "1R01_recto.jpg"
      },
      "published": true
    },
    {
      "id": "1R03",
      "ministries": [
        "EFFORT"
      ],
      "rank": 3,
      "stats": {
        "tech": 4,
        "melee": 2,
        "ranged": 0,
        "dodge": 5
      },
      "lifeLine": [
        "S",
        "S",
        "S",
        "T",
        "S",
        "S",
        "S",
        "S",
        "T",
        "S",
        "S",
        "S"
      ],
      "abilities": [
        {
          "timing": "Active",
          "actionCost": 0,
          "darknessCost": 0,
          "frequencies": [
            {
              "count": 1,
              "per": "CYCLE"
            }
          ]
        }
      ],
      "art": {
        "front": "1R03_recto.jpg"
      },
      "published": true
    },
    {
      "id": "1R09",
      "ministries": [
        "AXIS"
      ],
      "rank": 3,
      "stats": {
        "tech": 3,
        "melee": 4,
        "ranged": 0,
        "dodge": 5
      },
      "lifeLine": [
        "T",
        "S",
        "S",
        "T",
        "S",
        "S",
        "S",
        "S",
        "T",
        "S",
        "S",
        "S"
      ],
      "abilities": [
        {
          "timing": "Active",
          "actionCost": 0,
          "darknessCost": 0
        }
      ],
      "art": {
        "front": "1R09_recto.jpg"
      },
      "published": true
    },
    {
      "id": "1R12",
      "ministries": [
        "EDIFICATION"
      ],
      "rank": 3,
      "stats": {
        "tech": 4,
        "melee": 1,
        "ranged": 0,
        "dodge": 3
      },
      "lifeLine": [
        "S",
        "S",
        "S",
        "T",
        "S",
        "S",
        "T",
        "S",
        "S",
        "S",
        "S",
        "S"
      ],
      "abilities": [
        {
          "timing": "Permanent",
          "actionCost": 0,
          "darknessCost": 0
        }
      ],
      "art": {
        "front": "1R12_recto.jpg"
      },
      "published": true
    },
    {
      "id": "1R16",
      "ministries": [
        "INTEGRITY"
      ],
      "rank": 3,
      "stats": {
        "tech": 5,
        "melee": 2,
        "ranged": 0,
        "dodge": 4
      },
      "lifeLine": [
        "S",
        "S",
        "S",
        "S",
        "S",
        "S",
        "T",
        "S",
        "S",
        "S",
        "S",
        "S"
      ],
      "abilities": [
        {
          "timing": "Permanent",
          "actionCost": 0,
          "darknessCost": 0
        }
      ],
      "art": {
        "front": "1R16_recto.jpg"
      },
      "published": true
    },
    {
      "id": "1R19",
      "ministries": [
        "COORDINATION"
      ],
      "rank": 3,
      "stats": {
        "tech": 4,
        "melee": 1,
        "ranged": 0,
        "dodge": 5
      },
      "lifeLine": [
        "S",
        "S",
        "S",
        "S",
        "S",
        "T",
        "S",
        "S",
        "T",
        "S",
        "S",
        "S"
      ],
      "abilities": [
        {
          "timing": "Permanent",
          "actionCost": 0,
          "darknessCost": 0
        }
      ],
      "art": {
        "front": "1R19_recto.jpg"
      },
      "published": true
    },
    {
      "id": "1R22",
      "ministries": [
        "HARMONY"
      ],
      "rank": 3,
      "stats": {
        "tech": 2,
        "melee": 4,
        "ranged": 0,
        "dodge": 4
      },
      "lifeLine": [
        "S",
        "S",
        "S",
        "S",
        "S",
        "T",
        "R",
        "R",
        "R",
        "R",
        "R",
        "R"
      ],
      "abilities": [
        {
          "timing": "Permanent",
          "actionCost": 0,
          "darknessCost": 0
        }
      ],
      "art": {
        "front": "1R22_recto.jpg"
      },
      "published": true
    },
    {
      "id": "1R23",
      "ministries": [
        "EDIFICATION"
      ],
      "rank": 3,
      "stats": {
        "tech": 4,
        "melee": 2,
        "ranged": 0,
        "dodge": 5
      },
      "lifeLine": [
        "S",
        "S",
        "S",
        "T",
        "S",
        "S",
        "S",
        "T",
        "S",
        "S",
        "S",
        "S"
      ],
      "abilities": [
        {
          "timing": "Permanent",
          "actionCost": 0,
          "darknessCost": 0,
          "frequencies": [
            {
              "count": 1,
              "per": "PLANNING_PHASE"
            }
          ]
        }
      ],
      "art": {
        "front": "1R23_recto.jpg"
      },
      "published": true
    },
    {
      "id": "1R26",
      "ministries": [
        "PROGRESS"
      ],
      "rank": 3,
      "stats": {
        "tech": 5,
        "melee": 1,
        "ranged": 6,
        "dodge": 5
      },
      "lifeLine": [
        "S",
        "S",
        "S",
        "S",
        "S",
        "S",
        "S",
        "S",
        "S",
        "S",
        "S",
        "S"
      ],
      "abilities": [
        {
          "timing": "Active",
          "actionCost": 0,
          "darknessCost": 0,
          "frequencies": [
            {
              "count": 1,
              "per": "CYCLE"
            }
          ]
        }
      ],
      "art": {
        "front": "1R26_recto.jpg"
      },
      "published": true
    },
    {
      "id": "1R29",
      "ministries": [
        "SECURITY"
      ],
      "rank": 3,
      "stats": {
        "tech": 3,
        "melee": 3,
        "ranged": 6,
        "dodge": 3
      },
      "lifeLine": [
        "R",
        "R",
        "R",
        "R",
        "R",
        "T",
        "S",
        "S",
        "S",
        "S",
        "S",
        "S"
      ],
      "abilities": [
        {
          "timing": "Active",
          "actionCost": 0,
          "darknessCost": 0,
          "frequencies": [
            {
              "count": 1,
              "per": "CYCLE"
            }
          ]
        }
      ],
      "art": {
        "front": "1R29_recto.jpg"
      },
      "published": true
    },
    {
      "id": "2R02",
      "ministries": [
        "PROGRESS"
      ],
      "rank": 2,
      "stats": {
        "tech": 5,
        "melee": 1,
        "ranged": 0,
        "dodge": 4
      },
      "lifeLine": [
        "S",
        "S",
        "T",
        "S",
        "S",
        "S",
        "S",
        "T",
        "S",
        "S",
        "S",
        "S"
      ],
      "abilities": [
        {
          "timing": "Active",
          "actionCost": 0,
          "darknessCost": 0,
          "frequencies": [
            {
              "count": 1,
              "per": "PLANNING_PHASE"
            }
          ]
        }
      ],
      "art": {
        "front": "2R02_recto.jpg"
      },
      "published": true
    },
    {
      "id": "2R04",
      "ministries": [
        "COORDINATION"
      ],
      "rank": 2,
      "stats": {
        "tech": 2,
        "melee": 3,
        "ranged": 5,
        "dodge": 4
      },
      "lifeLine": [
        "R",
        "R",
        "S",
        "S",
        "S",
        "S",
        "T",
        "S",
        "S",
        "S",
        "S",
        "S"
      ],
      "abilities": [
        {
          "timing": "Permanent",
          "actionCost": 0,
          "darknessCost": 0
        }
      ],
      "art": {
        "front": "2R04_recto.jpg"
      },
      "published": true
    },
    {
      "id": "2R08",
      "ministries": [
        "AXIS"
      ],
      "rank": 2,
      "stats": {
        "tech": 2,
        "melee": 3,
        "ranged": 0,
        "dodge": 4
      },
      "lifeLine": [
        "T",
        "S",
        "S",
        "S",
        "S",
        "T",
        "S",
        "S",
        "S",
        "S",
        "T",
        "S"
      ],
      "abilities": [
        {
          "timing": "Permanent",
          "actionCost": 0,
          "darknessCost": 0
        }
      ],
      "art": {
        "front": "2R08_recto.jpg"
      },
      "published": true
    },
    {
      "id": "2R11",
      "ministries": [
        "EFFORT"
      ],
      "rank": 2,
      "stats": {
        "tech": 4,
        "melee": 2,
        "ranged": 0,
        "dodge": 4
      },
      "lifeLine": [
        "S",
        "T",
        "S",
        "S",
        "S",
        "T",
        "S",
        "S",
        "S",
        "S",
        "S",
        "S"
      ],
      "abilities": [
        {
          "timing": "Active",
          "actionCost": 0,
          "darknessCost": 0,
          "frequencies": [
            {
              "count": 1,
              "per": "PLANNING_PHASE"
            }
          ]
        }
      ],
      "art": {
        "front": "2R11_recto.jpg"
      },
      "published": true
    },
    {
      "id": "2R15",
      "ministries": [
        "EFFORT"
      ],
      "rank": 2,
      "stats": {
        "tech": 3,
        "melee": 2,